<?xml version="1.0" encoding="UTF-8"?>
<rrs:epr xmlns:rrs="http://uni-stuttgart.de/simpl/rrs" xmlns:xsi="http://www.w3.org/2001/XMLSchema-instance" xsi:schemaLocation="http://uni-stuttgart.de/simpl/rrs rrs.xsd ">
  <rrs:address>http://tempuri.org</rrs:address>
  <rrs:referenceProperties>
    <rrs:resolutionSystem>rrs:resolutionSystem</rrs:resolutionSystem>
  </rrs:referenceProperties>
  <rrs:referenceParameters>
    <rrs:referenceName>rrs:referenceName</rrs:referenceName>
    <rrs:statement>rrs:statement</rrs:statement>
  </rrs:referenceParameters>
  <rrs:portType>QName</rrs:portType>
  <rrs:serviceName portName="NCName">QName</rrs:serviceName>
  <rrs:policy>rrs:policy</rrs:policy>
</rrs:epr>
